"username","commentcount","likecount","type","description","pubyear","pubmonth","pubday","posturl"
"kamalaharris","83","9164","Photo","To all LGBTQ youth who face bullying and harassment because of their identities: We have your back today and every day. #SpiritDay","2017","10","19","https://www.instagram.com/p/BacErialqsh/"
"kamalaharris","23","3859","Photo",,"2017","10","18","https://www.instagram.com/p/BaZ0mqpl7iA/"
"kamalaharris","55","4303","Photo","This weekend Governor Brown, Senator Feinstein, and I surveyed wildfire damage and met with North Bay residents. There are so many courageous people in communities across our state, who have endured incredible loss, and we will do everything we can to support you. 📷: Governor Brown","2017","10","16","https://www.instagram.com/p/BaUa2aYlkS_/"
"kamalaharris","102","6396","Photo","#FlashbackFriday to 2007 when I was reelected for a second term as San Francisco’s District Attorney, where I ran on a platform of reforming our criminal justice system.","2017","10","14","https://www.instagram.com/p/BaNTxchlJ1g/"
"kamalaharris","153","11947","Photo","Happy birthday to my wonderful husband Doug! Can't wait to celebrate your special day with you.","2017","10","13","https://www.instagram.com/p/BaMqH2ilcR5/"
"kamalaharris","54","6316","Photo","Reminder: We’re 12 days into October and Congress has yet to renew CHIP, the children’s health insurance program, after funding expired. We must act now.","2017","10","12","https://www.instagram.com/p/BaKE_QNF0HZ/"
"kamalaharris","100","6237","Photo",,"2017","10","11","https://www.instagram.com/p/BaH5UWWFIBW/"
"kamalaharris","44","3506","Photo","Roberto Clemente, born in Puerto Rico, was inducted into the National Baseball Hall of Fame. As a child, Roberto grew up playing sports and at 17 he played for the Santurce Crabbers of the Puerto Rican Baseball League. A year later, he signed a minor league deal with the Dodgers before moving to the Pittsburgh Pirates. Roberto would go on to win four National League batting titles, the NL Most Valuable Player Award and twelve straight Gold Glove Awards. In the 1972 season, he reached 3,000 career hits before he was killed in a plane crash while transporting supplies to survivors of a Nicaragua earthquake. #HispanicHeritageMonth","2017","10","10","https://www.instagram.com/p/BaFRfpuFaQ_/"
"kamalaharris","80","11003","Photo","Keep fighting every single day to defend and expand on the progress made for women’s rights and reproductive health. We can’t fall backward.","2017","10","8","https://www.instagram.com/p/BZ_t_apFT1_/"
"kamalaharris","66","4576","Video","To everyone fighting for our Dreamers: Walk with your chin up and shoulders back. You are fighting for the future of this country. 📹: @nowthisnews","2017","10","7","https://www.instagram.com/p/BZ9Np6dF9J3/"
"kamalaharris","123","9671","Photo","❤️️","2017","10","7","https://www.instagram.com/p/BZ7TShQlnVO/"
"kamalaharris","436","5017","Photo",,"2017","10","6","https://www.instagram.com/p/BZ6XeiFFZ7q/"
"kamalaharris","74","4116","Video","Young Dreamers across the country are terrified. We made a promise to them that we would not deport them. We must pass the Dream Act. 📹: @MoveOn","2017","10","5","https://www.instagram.com/p/BZ4BYptF75V/"
"kamalaharris","67","5661","Photo","DACA recipients were never notified directly of the changes in rules. That’s just wrong.","2017","10","4","https://www.instagram.com/p/BZ1VplYFlII/"
"kamalaharris","36","5088","Photo","Dreamers are absolutely terrified that someone’s going to come and take them away from the only country they’ve ever called home. That’s why I’m speaking up for DACA recipients and calling on Congress to pass the Dream Act now.","2017","10","3","https://www.instagram.com/p/BZy6qh3lHux/"
"kamalaharris","221","6556","Photo","Too many innocent lives have been lost. We cannot throw up our hands in despair. The time requires us to act.","2017","10","3","https://www.instagram.com/p/BZynb5TFVX1/"
"kamalaharris","66","9859","Photo","In 2009, Justice Sonia Sotomayor became the first Latina United State’s Supreme Court Justice. Justice Sotomayor grew up in New York City and became interested in law after she started watching legal dramas on TV. She graduated summa cum laude from Princeton University, earning the university’s highest academic honor, and then attended Yale Law School. She was nominated to the Supreme Court by President Barack Obama in 2009. On the bench, she has fought for the voices of the people, including voting against Citizens United, to protect affirmative action programs, to uphold the Affordable Care Act, and in favor of marriage equality. #HispanicHeritageMonth","2017","10","2","https://www.instagram.com/p/BZubgaHD8Co/"
"kamalaharris","22","6102","Photo","Today is National Public Lands Day, a time to celebrate the magnificent natural beauty our nation and state have to offer. It also serves as a reminder of the need to preserve our nation’s natural beauty so that future generations can enjoy it. From walking amongst tall redwoods to hiking up California’s soaring mountains, I hope you take a moment to explore today.","2017","10","1","https://www.instagram.com/p/BZr5pwNF0sH/"
"kamalaharris","141","17722","Photo","In times of crisis, Americans prove we are stronger when we come together and lift each other up. We have to help our brothers and sisters in Puerto Rico. Click the link in the bio to donate now.","2017","9","30","https://www.instagram.com/p/BZrmRRfFNiT/"
"kamalaharris","23","2861","Photo",,"2017","9","29","https://www.instagram.com/p/BZoZqx2Drn9/"
"kamalaharris","59","4732","Photo","During Hispanic Heritage Month, we honor César E. Chávez, the great labor leader and civil rights activist. Early in his life, Chávez worked in California’s fields doing backbreaking labor, which propelled him to fight for improved farmworker conditions. In 1962 he founded what would later become the United Farm Workers, bringing attention to the plight of farmworkers through nonviolent means. As he once said, “Our ambitions must be broad enough to include the aspirations and needs of others, for their sakes and for our own.” Throughout Chávez’s life, he led marches, boycotts, and several hunger strikes to protest worker treatment, pay, and conditions.","2017","9","29","https://www.instagram.com/p/BZmtz6ijozl/"
"kamalaharris","18","2209","Photo","Federal funding for CHIP, the public health insurance program for low-income children, expires in two days. Not reauthorizing funding would leave nearly nine million children vulnerable without health care coverage. Congress must act now.","2017","9","28","https://www.instagram.com/p/BZl2xEKFTsp/"
"kamalaharris","372","20554","Photo",,"2017","9","26","https://www.instagram.com/p/BZhBpvwj9Bk/"
"kamalaharris","14","2794","Photo","“When my husband lost his job, the Affordable Care Act helped us as we got back on our feet. Because of it, our son with disabilities received all the necessary treatments and our other baby got his check-ups and shots. We were in the ER with our two children and Medicare under the Affordable Care Act expansion made sure we didn't get more bills that we couldn't afford. The Democrats looked out for my family and I'll never forget that.” —Julie from Spokane","2017","9","26","https://www.instagram.com/p/BZg3IsBDTfW/"
"kamalaharris","9","2198","Video","“I've survived ovarian cancer three times. Here's why: I have great healthcare. Every Republican repeal and replace plan would leave me defenseless. I'm not saying I deserve to live. But I don't deserve to be abandoned. Believe me, cancer changes a person: I have used every single day of my remission to make a difference. I changed my career and now work with cancer survivors to give them hope. This is hard enough when we're just talking about how to survive the illness — let alone how to fight down the panic of knowing your insurance is waiting to throw you under the bus. That's what repeal and replace comes down to. It really means repeal my peace of mind and replace the endless streams of money to ‘caregivers’ who don't care. When it comes to cancer, there's no alien ‘they’ who don't deserve care. Cancer is too common. Cancer is ‘we.’” —Anne from Los Angeles","2017","9","25","https://www.instagram.com/p/BZenqsEjRto/"
"kamalaharris","78","10273","Photo","Sixty years ago today, nine Black students paved the way by integrating an all-white school following the Brown v. Board of Education decision that banned segregation. On their first day of school, the Little Rock Nine were escorted past an angry mob by federal troops to start their first day at Little Rock Central High. As the school year went on, they would endure violent threats, harassment, and even have acid thrown on them. The courage and bravery they embodied would pave the way for desegregation at schools, but the struggle they endured still persists today. Let us use today as a reminder that we must address the disparities in education for students of color.","2017","9","25","https://www.instagram.com/p/BZeDC44jycS/"
"kamalaharris","21","3723","Photo","“Five years ago, I was diagnosed with stage 4 melanoma, a week after turning 39. I had five tumors — one in my leg, two in my intestine, one in my lung, and one in my brain. I had multiple surgeries, radiation on my brain, and was treated with infusions of immunotherapy. I had excellent doctors because California has excellent doctors. Thank God, at that time, I was lucky. I had just signed up for the Affordable Care Act insurance, and I started a job three weeks before my first hospitalization. So I was covered. But what worries me is the future.

I currently see my oncologist every three months, alternating scans of my body and brain for any sign that my melanoma — a notoriously tricky, resilient, and deadly cancer when caught at stage 4 — has come back. If I face lifetime limits on my insurance, if I have to pay out of a health care savings account, if I'm put in an expensive high-risk pool or am placed on cut-rate insurance because I have a pre-existing condition, I'm done for. I cannot pay for it. My family cannot (even with insurance, sophisticated surgeries are expensive!). I'm asking you, please, as my representative, fight with everything you've got — as we, the sick, do.” .
—Justine from Los Angeles","2017","9","24","https://www.instagram.com/p/BZcDrlijs9s/"
"kamalaharris","112","7062","Video","Reforming our bail system is about economic justice.","2017","9","24","https://www.instagram.com/p/BZbxGSvDxuc/"
"kamalaharris","30","3006","Photo","“After graduating college ten years ago, I was without health coverage. I developed appendicitis and had to have surgery. It was that, or die. I had my student loan debt and accumulated new health care debt. It cost over $14,000 to make sure I did not die from appendicitis. I now have a full-time job with health benefits that I pay for and I am lucky for that. I can pay my part. We need to provide coverage to everyone. No one should have to second guess debt in exchange for life.” —David from Cortland","2017","9","23","https://www.instagram.com/p/BZZLtscjyJz/"
"kamalaharris","58","10377","Photo",,"2017","9","22","https://www.instagram.com/p/BZWpKA8jEZi/"
"kamalaharris","42","4937","Photo","“I am a breast cancer survivor. Experienced the horrors of a mastectomy, large biopsy, chemotherapy and several reconstructive therapies! As a result, I have lymphedema, a lifelong medical condition. My compression machines were $7,000 each. Compression garments are costly as well. Now I’m dealing with thyroid dysfunction and medications. All of this would be a nightmare if I did not have health care!” —Lorna from Riverside","2017","9","22","https://www.instagram.com/p/BZWY_WwDFAI/"
"kamalaharris","135","6380","Video","It would be an irresponsible to take health care away from tens of millions of people to back a flawed campaign promise.","2017","9","21","https://www.instagram.com/p/BZUboj0Dl8J/"
"kamalaharris","97","5328","Photo","The last time Republican leaders tried to repeal the ACA, I shared personal stories from people who have benefited from the Affordable Care Act. I believe we must elevate the voices and the faces of who will be most hurt by the Graham-Cassidy bill. •••••••••••••••••••••••••••••••••••••••••
“My daughter was born with severe hydrocephalus. No one knows why. I did all the things a pregnant mom is supposed to do to take care of her growing child. She had brain surgery at one day old to place a shunt. Within a month she needed it replaced. At 14 months her shunt failed again with catastrophic consequences — severe brain injury. She now requires 24/7 care. We would be on the streets without Medicaid and the Affordable Care Act. We are not leeches on society. I have a Masters degree, 3 professional certificates, work a full-time job, and am a professional photographer on the side. We are having trouble finding adequate nursing care so that she can live at home with her family. Why are Republicans so hell bent on taking our security away? I pay taxes willingly and am grateful for our security net.” —Debra from Orange County","2017","9","21","https://www.instagram.com/p/BZUEXQ7DFN2/"
"kamalaharris","95","5812","Video","The people won last time. So keep calling and writing letters. Time to defeat this “health care” bill once and for all: (202) 224-3121.","2017","9","20","https://www.instagram.com/p/BZRqOFRD1fn/"
"kamalaharris","43","6171","Photo","We have ten days or less to defeat the Graham-Cassidy repeal bill. Let that sink in: Ten days. This bill would effectively eliminate the guarantee of protections for people with pre-existing conditions and gut Medicaid, which children, low-income Americans, and ​seniors rely on. This health care battle is personal to each and every one of us. Tell me your story at the link in my bio.","2017","9","20","https://www.instagram.com/p/BZRBlcQDMrs/"
"kamalaharris","56","5128","Photo","The Graham-Cassidy bill would be disastrous for Americans. Besides raising premiums, it would also weaken pre-existing conditions protections, leaving many without access to the health services they need. Memorize this number and call to save our health care: (202) 224–3121.","2017","9","19","https://www.instagram.com/p/BZPVaIYDyDo/"
"kamalaharris","58","6471","Photo","Throughout Hispanic Heritage Month, I will highlight Americans who are making a difference in their communities and the world. First is Dolores Huerta, a leader in the farm worker, women’s, and civil rights movements. Dolores is known for co-founding what would become the United Farm Workers and also played a critical role in a strike against California grape growers. She was awarded the Presidential Medal of Freedom in 2012.","2017","9","19","https://www.instagram.com/p/BZOlztmFmD-/"
"kamalaharris","116","16084","Video","“The things that make us different, those are our superpowers.” Congratulations @LenaWaithe on making history last night!","2017","9","18","https://www.instagram.com/p/BZL7x4rFc5x/"
"kamalaharris","150","13092","Photo","I’ve been fighting for Dreamers since day one and I know I, and people across the country, won’t be giving up on them.","2017","9","16","https://www.instagram.com/p/BZG-bMdlIUF/"
"kamalaharris","268","9268","Video","The difference between sitting in jail or not before trial should be based on the risk you pose to the community, not how much money you have. (via @NowThis)","2017","9","15","https://www.instagram.com/p/BZEkQV5DzaI/"
"kamalaharris","125","6489","Photo","Cancer, diabetes, and high blood pressure affect folks whether they’re in a red state or a blue state. All Americans should receive the health care they need regardless of where they live or their income. That’s what Medicare for All is about and why I joined Senator Sanders’ bill.","2017","9","14","https://www.instagram.com/p/BZBv8yIjudV/"
"kamalaharris","90","6590","Photo","Dreamers know no other home than the United States. That's why over the next few days, I’m going to share stories of people who wrote in saying why they support Dreamers.","2017","9","12","https://www.instagram.com/p/BY8ifIjjSBR/"
"kamalaharris","32","8231","Photo","Our nation will never forget those we lost on September 11, 2001 and the brave first responders who risked and gave their lives to save others. #NeverForget","2017","9","11","https://www.instagram.com/p/BY52UrCDQdG/"
"kamalaharris","72","5724","Photo","The people of California are holding Floridians in our thoughts and prayers today.","2017","9","10","https://www.instagram.com/p/BY3wPYnDFMY/"
"kamalaharris","265","9654","Video","Under our broken bail system, many times a poor person pays a premium that a rich person doesn’t.","2017","9","9","https://www.instagram.com/p/BY07pOUjuwj/"
"kamalaharris","167","4323","Video","Who do I regret not putting on my Spotify playlist? I answer that during the lightning round with Ari Melber.","2017","9","8","https://www.instagram.com/p/BYyVTaGDIQy/"
"kamalaharris","52","5849","Photo","40% of Fortune 500 companies were created by immigrants or the children of immigrants. Immigrants make us a stronger and more prosperous nation. #HereToStay","2017","9","7","https://www.instagram.com/p/BYv6zV9jdUW/"
"kamalaharris","111","9034","Photo","By turning his back on the Dreamers, Trump is telling students in our schools that they don’t belong, employees of Fortune 500 companies that they aren’t welcome, and saying to those who serve in our military that they shouldn’t be here. Should Congress fail to act and reverse Trump’s decision, the consequences will be devastating. We must immediately allow a vote on the DREAM Act, a bipartisan bill I’ve co-sponsored that would permanently protect 800,000 Dreamers from deportation.","2017","9","7","https://www.instagram.com/p/BYuDbRsDNEa/"
"kamalaharris","147","8077","Video","800,000 Dreamers know only one home — the United States of America. Passing the DREAM Act is the right thing to do.","2017","9","6","https://www.instagram.com/p/BYtfvUUjCqX/"
"kamalaharris","212","9840","Photo",,"2017","9","5","https://www.instagram.com/p/BYqfwolDxQU/"
"kamalaharris","25","4098","Photo","On Labor Day, we celebrate California workers and the labor movement that brought us a minimum wage, weekends, and other worker protections.","2017","9","4","https://www.instagram.com/p/BYoT9HDj9J_/"
"kamalaharris","96","5345","Video","Houston has shown us who we are as a country. When we see someone in need, we help out.","2017","9","3","https://www.instagram.com/p/BYltvwpjeYz/"
"kamalaharris","18","3619","Photo","Just like yesterday, this weekend is going to be a scorcher across most of California. Make sure to check in on your neighbors and the elderly.","2017","9","2","https://www.instagram.com/p/BYi8NrWjKdq/"
"kamalaharris","46","6502","Photo","Eid Mubarak to all Muslims who are celebrating in California and around the country. #EidAlAdha","2017","9","1","https://www.instagram.com/p/BYgb9nYj7JO/"
"kamalaharris","33","4883","Photo","A little red, white, and blue and smiles all around for this #ThrowbackThursday from the campaign trail last year.","2017","8","31","https://www.instagram.com/p/BYd-uk2DXNq/"
"kamalaharris","334","17208","Photo",,"2017","8","31","https://www.instagram.com/p/BYb_CONDpvj/"
"kamalaharris","22","3585","Photo","When times are tough, we stand together, united. That’s why I’m asking you to make a donation to support local nonprofits in Texas that are helping our friends, family, and neighbors. Even a small contribution — whatever you can spare — can make an incredible difference. Link in the bio. 📷: FEMA News Photo","2017","8","30","https://www.instagram.com/p/BYbKajGDoT8/"
"kamalaharris","89","4747","Video","Yesterday I met with young Dreamers in California, which is home to the most DACA recipients in the country. As DACA is under attack by this administration, we have to understand that if we’re going to be true to our values, true to our ideals, and true to our history, then we must keep a path open for these young people and not let their parents suffer in the process. I promise I will fight to preserve DACA protections and work toward comprehensive immigration reform.","2017","8","29","https://www.instagram.com/p/BYYlhxWjtc0/"
"kamalaharris","40","7741","Photo","On this day in 1963, during the March on Washington, Dr. Martin Luther King, Jr. gave his “I Have a Dream” speech. To a crowd of more than 200,000 people, he spoke about the need to fight for justice and end bigotry at a time when millions of Americans were denied basic civil rights. Today, we must continue that fight and recommit ourselves to Dr. King’s vision. ""Let us not seek to satisfy our thirst for freedom by drinking from the cup of bitterness and hatred.""","2017","8","29","https://www.instagram.com/p/BYW3n9eDrzQ/"
"kamalaharris","44","4751","Photo","Dozens of California’s emergency responders are heading to Texas to help with Harvey rescue efforts. As Americans, that’s what we do: help each other out in our time of need. If you or someone you know is in Houston and you can get in contact with them, direct them to call 911 for life-threatening emergencies, and (713) 884-3131 if they need help leaving their home.","2017","8","28","https://www.instagram.com/p/BYWI2AVji4-/"
"kamalaharris","33","5232","Photo","From DACA to climate change, so many important issues being debated right now. Talk to your representatives and tell them what matters to you.","2017","8","27","https://www.instagram.com/p/BYUBZg4D8eK/"
"kamalaharris","58","7726","Photo","#WomensEqualityDay","2017","8","26","https://www.instagram.com/p/BYRSRV3D-P2/"
"kamalaharris","261","18161","Photo",,"2017","8","26","https://www.instagram.com/p/BYPZIENjxUv/"
"kamalaharris","23","3906","Photo","#FlashbackFriday to life on the campaign trail last year.","2017","8","25","https://www.instagram.com/p/BYOYA9YjpLI/"
"kamalaharris","63","5728","Photo","Children are our nation’s future. We must listen to them about what they care about and help give them a voice in our government.","2017","8","24","https://www.instagram.com/p/BYLzXj0DytW/"
"kamalaharris","37","5511","Photo","“Our ambitions must be broad enough to include the aspirations and needs of others, for their sakes and for our own.” —Cesar Chavez","2017","8","24","https://www.instagram.com/p/BYKLwWAFXJM/"
"kamalaharris","29","3817","Photo","Yesterday I spoke at the 21st Annual Lake Tahoe Summit. As a child, I visited Lake Tahoe with my family and there are few places more magnificent. This lake is one of the jewels of the world and we must do what we can to make sure we keep it blue, we keep it clear, and we keep it protected in a way that future generations can enjoy it. And this applies not only to Lake Tahoe, but all bodies of water across our nation.","2017","8","23","https://www.instagram.com/p/BYJTmxaFvG-/"
"kamalaharris","476","23654","Photo","Happy Anniversary to my incredible husband, Doug!","2017","8","22","https://www.instagram.com/p/BYHMRIIFOjQ/"
"kamalaharris","205","10665","Photo",,"2017","8","22","https://www.instagram.com/p/BYGyoNKlbSL/"
"kamalaharris","37","4428","Photo","Our nation’s natural beauty should be preserved for future generations, not drilled and cut up into kindling.","2017","8","21","https://www.instagram.com/p/BYEPz0WFABh/"
"kamalaharris","51","4634","Photo","I strongly believe in the protection of workers’ rights for all Californians, from increasing the minimum wage to improving workers compensation and other workplace protections.","2017","8","20","https://www.instagram.com/p/BYBv01vlrBj/"
"kamalaharris","99","7467","Photo",,"2017","8","19","https://www.instagram.com/p/BX-2zrWlwnb/"
"kamalaharris","44","4995","Photo","Each and every day let’s continue to live by example and prove once and for all that America is a strong nation because of our diversity.","2017","8","18","https://www.instagram.com/p/BX8drYflAFc/"
"kamalaharris","90","8752","Photo","#TBT to when I was sworn in for a second term as San Francisco’s District Attorney by Senator Dianne Feinstein, who’s now my colleague in the Senate.","2017","8","17","https://www.instagram.com/p/BX5-thIjYkf/"
"kamalaharris","93","8675","Photo","Women are 50% of the population but hold only 23% of seats in national legislatures. It’s time to change that.","2017","8","16","https://www.instagram.com/p/BX3aBu3lO7j/"
"kamalaharris","158","19235","Photo",,"2017","8","15","https://www.instagram.com/p/BX1RU4SFK7N/"
"kamalaharris","358","17135","Photo","An imperative step forward: The federal Bureau of Prisons will now require prisons to provide basic hygiene products to female inmates. This is about ensuring health, dignity, and respect. Link to article in the bio.","2017","8","15","https://www.instagram.com/p/BX0k3s9lBjP/"
"kamalaharris","107","9913","Photo","After the tragedy that unfolded this weekend, it’s more important than ever before that we work together to advance the cause of justice and equality. Take action and make it clear that love, justice, equality, and tolerance will defeat racism, white supremacy, violence, and hate.","2017","8","14","https://www.instagram.com/p/BXyHY2ilLQK/"
"kamalaharris","595","23221","Photo","Heather Heyer, 32-years-old, was the victim of white supremacist violence yesterday in Charlottesville. 
Rest In Peace.","2017","8","13","https://www.instagram.com/p/BXvaWUOFOqs/"
"kamalaharris","204","4434","Photo","It’s simple: we must protect the right to organize to rebuild our middle-class.","2017","8","11","https://www.instagram.com/p/BXqN4pdFYm1/"
