"username","commentcount","likecount","type","description","pubyear","pubmonth","pubday","posturl"
"kamalaharris","4","172","Photo","Student loan debt is a crushing burden that slows our economy and puts the American Dream out of reach for many. This is why I unveiled a plan to help prevent and reduce student loan debt and start our students out on the right foot → kamalaharris.org/freedomtolearn/","2016","9","30","https://www.instagram.com/p/BK_Gn2tAbXz/"
"kamalaharris","1","311","Photo","Thank you to Carsie for joining us at our campaign HQ phone bank and talking to voters about what’s at stake in this election! If you’re in the LA area and want to volunteer too, sign up on our website.","2016","9","30","https://www.instagram.com/p/BK9aPG0g654/"
"kamalaharris","15","626","Photo","Honored to have the endorsement of @gabbygiffords and @shuttlecdrkelly! Congress’ failure to pass enhanced background check laws and renew the assault weapons ban is shameful. Together, we must make sure guns stay out of the wrong hands.","2016","9","29","https://www.instagram.com/p/BK8w4i4g22_/"
"kamalaharris","2","273","Photo","Thanks to the respiratory care class at Modesto Junior College for welcoming me today. Keep up the great work!","2016","9","29","https://www.instagram.com/p/BK6_KxhAAQ2/"
"kamalaharris","2","339","Photo","Chef Charles Phan has an incredible story of courage, determination, and finding his American dream. After immigrating to the U.S. with his family, he attended UC Berkeley and opened @slanteddoor, a San Francisco institution. When you go, be sure to get one of my favorites — the spring rolls!","2016","9","28","https://www.instagram.com/p/BK6qkukg6kG/"
"kamalaharris","7","391","Video","I got to meet Nairah in San Diego and she had a very important question for me about the campaign. #KidsForKamala","2016","9","26","https://www.instagram.com/p/BK1Lgt1gb-g/"
"kamalaharris","3","292","Photo","This election is about what we can do together.","2016","9","25","https://www.instagram.com/p/BKyUzPADefR/"
"kamalaharris","2","132","Video","Thanks to the students and faculty at LA Trade Tech for joining me for a discussion on my new proposals to make higher education affordable for families. To Diane and millions of students like her: you’re not alone - we’re going to change this system together.","2016","9","25","https://www.instagram.com/p/BKwpN8rjyuR/"
"kamalaharris","1","185","Photo","Today we celebrate California’s tall redwoods, vast deserts, stunning sandy beaches, rushing rivers, soaring mountains, and rolling hills. Take a moment to enjoy the great outdoors and find a National Public Lands Day event near you → https://www.neefusa.org/find-an-event","2016","9","24","https://www.instagram.com/p/BKwEUSEjEPs/"
"kamalaharris","1","159","Photo","When elected to the Senate, I’ll continue fighting for universal early childhood education. Students should be able to enter school ready to learn.","2016","9","23","https://www.instagram.com/p/BKtv1Z3jYvR/"
"kamalaharris","7","358","Photo","Dropped by the North Park Thursday Market in San Diego with @toddgloria! #KidsForKamala","2016","9","23","https://www.instagram.com/p/BKrfE6VjGRL/"
"kamalaharris","5","327","Photo","My college affordability plan includes a student bill of rights to protect those who are seeking a higher education.","2016","9","23","https://www.instagram.com/p/BKrbxR_jXk8/"
"kamalaharris","2","183","Photo","Thank you, @toddgloria, for helping me tell #SanDiego about my college affordability plan, Freedom to Learn.","2016","9","23","https://www.instagram.com/p/BKrappNDTFD/"
"kamalaharris","7","498","Photo","#TBT to the day I graduated from law school. Graduation should be a memorable moment, but for far too many students, the thought of the tens of thousands of dollars of debt can put a damper on an otherwise joyous day. Learn more about my plan to tackle the student loan debt crisis→ kamalaharris.org/learn-more","2016","9","22","https://www.instagram.com/p/BKqfhCGjAiz/"
"kamalaharris","6","323","Photo","Today we reflect on how we can forge the desire for lasting peace and stability throughout the world.","2016","9","22","https://www.instagram.com/p/BKo1Dt4Drfp/"
"kamalaharris","2","224","Photo","The American workforce is changing—low skill jobs are on the decline, while high skill jobs requiring a college degree are becoming a greater share of the labor market. We must ensure that America’s young people aren’t forced to take on staggering amounts of debt in order to obtain the college education they need in order to succeed in life. This is why we must make community colleges free and public colleges free for students whose families earn less than $140,000 a year.","2016","9","20","https://www.instagram.com/p/BKl0F68jmqL/"
"kamalaharris","1","172","Photo","Today I'm speaking with LA Trade Tech students and faculty about the importance of creating a higher education system that's affordable for students, and how we can work together to do it.","2016","9","20","https://www.instagram.com/p/BKlsi7ZD-oI/"
"kamalaharris","3","190","Photo","Today I'm at LA Trade Tech hearing from students who were scammed by predatory for-profit schools before transferring to #LATTC.","2016","9","20","https://www.instagram.com/p/BKlrHWcDiN2/"
"kamalaharris","0","131","Photo","We have an opportunity and a responsibility to train the next generation of workers and keep our economy competitive. But with the high cost of a higher education and the crushing student debt cycle, the system is broken. In fact, students now owe $1.3 trillion in student loan debt, which represents the second largest form of consumer debt outside of mortgages. Today I’m unveiling key policies on how we can make higher education more affordable. Have questions about my policies? I’ll be answering live on Facebook at 2pm PT.","2016","9","20","https://www.instagram.com/p/BKlhyNhDXa1/"
"kamalaharris","2","364","Photo","So proud to keynote the Equality Awards Saturday. Grateful for Equality California &amp; the LGBT civil rights work they do. What an inspiring night!","2016","9","20","https://www.instagram.com/p/BKjrkXUDyfK/"
"kamalaharris","2","166","Photo","We need to elect lawmakers up and down the ballot who will bring people together to tackle tough issues like criminal justice reform and college affordability. But you have to be registered to vote in order to do that. 
http://registertovote.ca.gov/","2016","9","19","https://www.instagram.com/p/BKjCkLFjpRg/"
"kamalaharris","15","971","Photo","@elizabethbanks is on #TeamKamala! Get involved by clicking the link in my bio.","2016","9","19","https://www.instagram.com/p/BKhNZpPDnCZ/"
"kamalaharris","4","295","Photo","Tune in Tuesday, September 20 at 2 p.m. PST for a Facebook live chat on college affordability. It’s unacceptable that students take out loans averaging more than $35,000 by the time they graduate. Have questions on how we can make college more affordable? Post your questions below in the comments section and I’ll answer them on Tuesday.","2016","9","18","https://www.instagram.com/p/BKgO1SjDIvK/"
"kamalaharris","5","444","Photo","At @eqca's #EqualityAwards this evening.","2016","9","18","https://www.instagram.com/p/BKeycaXj1in/"
"kamalaharris","3","246","Photo","Before the #EqualityAwards started I got to meet with the @eqca fellows, an impressive group of leaders under 30!","2016","9","18","https://www.instagram.com/p/BKevRm6jOLA/"
"kamalaharris","7","236","Photo","On this day in 1787, America’s Founding Fathers signed the United States Constitution. We must continue to guarantee individual constitutional rights within and outside the criminal justice system.","2016","9","18","https://www.instagram.com/p/BKegmTQjDZt/"
"kamalaharris","7","382","Photo","Ever since I was young, education has played a large role in my life. But things have changed since I graduated. Education costs have exponentially soared and the ladder of opportunity has broken. Students should not have to take on tens of thousands of dollars in debt in order to attend college. On Tuesday, September 20 at 2 p.m. PST, I’ll be answering your questions about higher education on Facebook Live. What do you want to know about? Post your questions in the comments below.","2016","9","17","https://www.instagram.com/p/BKd3VebD2Jn/"
"kamalaharris","1","302","Photo","Love my Delancey Family! Thanks to Delancey Street Foundation in LA for helping us host another great Prayer Breakfast. After our event I got to hear what the residents and staff were up to.","2016","9","17","https://www.instagram.com/p/BKb87WhDPTe/"
"kamalaharris","6","259","Photo","When students take on tens of thousands of dollars in debt to attend college, we know the system is broken. That’s why I support free tuition at community colleges.","2016","9","16","https://www.instagram.com/p/BKbarwGjnwG/"
"kamalaharris","3","307","Photo","California has the largest Hispanic population in the nation, at 15 million people. That’s why celebrating National Hispanic Heritage Month is so important. This is a time to recognize the history, contributions, and culture Hispanic Americans have to offer to our state and to our world.","2016","9","16","https://www.instagram.com/p/BKZXyf4j_7h/"
"kamalaharris","0","192","Photo","Meeting with Southern California faith and community leaders this morning for an Interfaith Prayer Breakfast!","2016","9","15","https://www.instagram.com/p/BKYp3smDK_c/"
"kamalaharris","4","257","Photo","Today is Native American Women’s Equal Pay Day, where we recognize that Native American women must work approximately nine extra months to earn the same amount men of all races earn in one year.","2016","9","15","https://www.instagram.com/p/BKYntv_DqkH/"
"kamalaharris","3","378","Photo","I dropped by the @laopinionla office! It's always good to see Damián Mazzotta &amp; Gabriel Lerner, plus Israel Consul General Sam Grundwerg.","2016","9","15","https://www.instagram.com/p/BKXCnF7DDM1/"
"kamalaharris","10","712","Photo","September 12, 1992, Dr. Mae Jemison was the first black woman to go into space. Today we honor her legacy and all the other barrier-breaking black women who have shown the world that we belong.","2016","9","13","https://www.instagram.com/p/BKRxr8tDPCb/"
"kamalaharris","3","489","Photo","#RedWhiteBlue #TeamKamala","2016","9","12","https://www.instagram.com/p/BKPHls0judZ/"
"kamalaharris","3","326","Photo","September 11, 2001 was a day that changed our nation forever. We must never forget those who lost their lives or the brave first responders who were heroes on that tragic day.","2016","9","11","https://www.instagram.com/p/BKOMw8IDEAB/"
"kamalaharris","1","336","Photo","Kicked off today's canvas with a rally in LA! Thanks, SEIU, for telling Californians why you're on #TeamKamala.","2016","9","11","https://www.instagram.com/p/BKM4LzVDwxY/"
"kamalaharris","1","225","Photo","Thank you to Gabi for the beautiful card and the Do-si-dos (my favorite Girl Scout cookies)! #KidsForKamala","2016","9","11","https://www.instagram.com/p/BKMjeMHjfeg/"
"kamalaharris","6","289","Photo","It’s time we repair the broken ladder of opportunity for families in California and across the country. First, we must raise the low federal minimum wage that makes it nearly impossible to support a family. Second, we must end the student debt crisis and create pathways for college students to graduate on time without mountains of debt. Third, we must strengthen Social Security and Medicare to keep millions of seniors and people living with disabilities out of poverty.","2016","9","10","https://www.instagram.com/p/BKMHNuyD4Bq/"
"kamalaharris","10","629","Photo","Hello, #Bruins! Got to sign the door at @UCLA today after a @PBS interview. We'll let you know when it airs.","2016","9","10","https://www.instagram.com/p/BKKJvx5jmH2/"
"kamalaharris","5","118","Video","Rudy’s on #TeamKamala! Tell us in the comment section why you are too.","2016","9","10","https://www.instagram.com/p/BKJ7l2MjbxF/"
"kamalaharris","3","362","Photo","When you get to work with smart, thoughtful young people like these, the future couldn’t look brighter! Thankful to have their feedback on our “Truth, Transparency, &amp; Trust in Law Enforcement” policy. Learn more at kamalaharris.org/learn-more","2016","9","9","https://www.instagram.com/p/BKJDhIAj52K/"
"kamalaharris","4","203","Photo","For far too many Californians, the prospect of amassing a large amount of debt deters them from pursuing higher education. This workforce skills gap could weaken our state’s economy, which is why it’s time to make higher education affordable for all.","2016","9","8","https://www.instagram.com/p/BKHS6BJD98O/"
"kamalaharris","4","327","Photo","Kicked off the week with hardworking labor leaders and their families! #UnionStrong #tbt","2016","9","8","https://www.instagram.com/p/BKGx-LrjkD5/"
"kamalaharris","6","447","Photo","With the rise of smartphones, we’ve been able to see more of what black communities have been experiencing their whole lives. These videos have shown us that it’s long past time we confront our broken criminal justice system. Last week I introduced proposals on how we can fix our failed system. While the proposals I introduced will not fix our system alone, they are a good place to start. Read it here → http://kamalaharris.org/Learn-More","2016","9","8","https://www.instagram.com/p/BKE7Kqlj-My/"
"kamalaharris","0","230","Video","I enjoyed a quick chat with Lebron and his dad on Labor Day! We talked about the importance of going to school every day and being good leaders. #KidsForKamala","2016","9","7","https://www.instagram.com/p/BKErOR0j62S/"
"kamalaharris","1","286","Photo","Wishing you and your family a happy #LaborDay! I had a great time celebrating at the annual Labor Day Parade and Festival in Wilmington! #KidsForKamala","2016","9","6","https://www.instagram.com/p/BJ_rEKGDIll/"
"kamalaharris","4","423","Photo","I got to meet Fernando and his adorable granddaughters while they were celebrating #LaborDay at the Los Angeles/Long Beach Harbor Labor Coalition Rally! Fernando is committed to the International Longshore and Warehouse Union and to having a positive impact on his community. #UnionStrong","2016","9","5","https://www.instagram.com/p/BJ_cUfRjETD/"
"kamalaharris","5","269","Photo","Happy Labor Day! Today we recognize the creation of the labor movement that has committed itself to fighting for better wages, safer factories, and reasonable hours. I’m proud to have the endorsement of numerous labor organizations. When elected to the Senate, I will continue to support the working people of California by protecting homeowners, standing up to big banks, and calling for trade deals that safeguard jobs.","2016","9","5","https://www.instagram.com/p/BJ-xBVyDe7Y/"
"kamalaharris","3","299","Photo","Every decision legislators make has a profound impact on our state’s youngest residents, our kids. From education funding to protecting the environment, the choices made now will impact their future. That’s why I’ve launched Kids for Kamala, a resource for kids and their families.","2016","9","5","https://www.instagram.com/p/BJ9CvPjjIMB/"
"kamalaharris","12","409","Photo","I’m running to become California’s next U.S. Senator so I can give a voice to the voiceless and make our state a safe place to live where families can thrive.","2016","9","4","https://www.instagram.com/p/BJ8L7ECjc7t/"
"kamalaharris","3","222","Photo","I’ve seen firsthand how communities of color want law enforcement in their communities – police who act fairly and impartially to strengthen neighborhoods and enhance public safety. This is why I’ve released a plan for a smarter criminal justice reform system → KamalaHarris.org/Learn-More","2016","9","3","https://www.instagram.com/p/BJ5_VRkjSv_/"
"kamalaharris","0","202","Photo","We must all remain vocal about the urgent need for criminal justice reform in this country — not only for us, but for our children and our children’s children.","2016","9","3","https://www.instagram.com/p/BJ35MkrjU1e/"
"kamalaharris","9","297","Video","Today Kids for Kamala launches! The more kids become involved in campaigns, the more they can remind people who are running for office that they matter. Even if they can’t vote, even if they can’t write a check, they matter.","2016","9","2","https://www.instagram.com/p/BJ3TOXyDqdI/"
"kamalaharris","2","480","Photo","Ena Sarker is on #TeamKamala! I’m so happy to have her enthusiastic support.","2016","9","2","https://www.instagram.com/p/BJ1kG7NjNLB/"
"kamalaharris","2","216","Photo","Instead of a criminal justice system that responds to all crimes identically, we need to take a “smart on crime” approach – one that focuses on the most serious and violent offenses and avoids treating all offenders the same way. Thank you, L. from Riverside, for sharing your story.","2016","9","1","https://www.instagram.com/p/BJ1L3FqDikG/"
"kamalaharris","6","344","Photo","Thank you, #MarkLeno, for 14 years of service in our state legislature! Your passion and collaborative spirit will be missed.","2016","9","1","https://www.instagram.com/p/BJy7qCiDBWT/"
"kamalaharris","2","246","Photo","A few weeks ago I asked Californians to share their personal stories about why they support criminal justice reform. Over the next few days, we’ll be sharing some of the stories that stood out.","2016","9","1","https://www.instagram.com/p/BJyvlkQDLAS/"
"kamalaharris","3","200","Photo","The young people participating in our criminal justice reform discussion tell me that we must work on building relationships between communities and law enforcement, and that all of us are accountable when it comes to making our criminal justice system more fair and effective. I agree wholeheartedly!","2016","8","30","https://www.instagram.com/p/BJv5OdRjmML/"
"kamalaharris","8","409","Photo","Timothy Walker isn't only an #SFSU student. He's also on the racial and identity profiling advisory board I recently swore in, and today he's part of our discussion on criminal justice reform.","2016","8","30","https://www.instagram.com/p/BJv2y51DhKZ/"
"kamalaharris","3","229","Photo","Speaking with community leaders at @cocosouthla about making our criminal justice system fairer &amp; more effective. Our discussion is focused on what I call the ""three Ts"" - truth, transparency, and trust.","2016","8","30","https://www.instagram.com/p/BJv0Ap7DO8Y/"
"kamalaharris","6","184","Photo","For far too long, our country’s criminal justice system has prioritized being “tough on crime” and offered a reactive approach to crime without addressing its root causes. It’s time for a change. We must reform our system to be “smart on crime” by focusing on crime prevention, recidivism reduction, and innovative, data-driven methods. Together, we can make our system fair and effective – and create safer communities.","2016","8","30","https://www.instagram.com/p/BJvoiQ7j9BJ/"
"kamalaharris","2","297","Photo","Racial profiling, bias, and the lack of trust between law enforcement and communities of color are national problems that require national solutions. This is why I’m unveiling key priorities for reform of the criminal justice system. Read more here → KamalaHarris.org/Learn-More","2016","8","30","https://www.instagram.com/p/BJvTOItD773/"
"kamalaharris","31","218","Photo","When our nation’s criminal justice system prioritizes being “tough on crime,” and responds to all crimes as equal, Americans lose. Tomorrow I will discuss how we can reform our criminal justice system and restore trust and accountability.","2016","8","29","https://www.instagram.com/p/BJtLJ18DNmQ/"
"kamalaharris","12","639","Photo","I’m so grateful to have the the long-term support of so many, like my friend Amelia Ashley-Ward. She has been on #TeamKamala since 2003. When I first ran for DA of San Francisco, we rented a trolley and rode up and down the streets telling San Franciscans how I would fight for justice for them. The trolley is gone, but Amelia is still helping me talk to Californians about what matters most to them!","2016","8","29","https://www.instagram.com/p/BJrOUQDDYZ2/"
"kamalaharris","2","356","Photo","Today marks the anniversary of the March on Washington and Dr. Martin Luther King, Jr.’s I Have a Dream speech. Dr.King inspired people to fight for and demand a more just nation in a time of when millions of Americans were denied basic human and civil rights. We must recommit ourselves to Dr. King's vision — his unyielding demand for justice and an end to bigotry. #MarchOnWashington #MartinLutherKingJr #IHadADream","2016","8","28","https://www.instagram.com/p/BJqeKrSjkOU/"
"kamalaharris","16","541","Photo","I grew up around adults who were committed to service and community involvement. I was inspired by them and so many others to become a lawyer and fight for the voiceless and for justice. I will do the same when elected to the Senate.","2016","8","27","https://www.instagram.com/p/BJoWP0ODrUK/"
"kamalaharris","6","604","Photo","Today I was interviewed by Goddaughter-in-Chief Helena, who had some tough questions! Find out what she asked me on behalf of California kids when we share the interview next week. 
#KidsForKamala","2016","8","27","https://www.instagram.com/p/BJmDt8UDfbu/"
"kamalaharris","3","293","Photo","This week I had the opportunity to meet with black publishers and radio executives from across the state. They’re creating innovative ways to get residents in their communities registered to vote! #MyVoteMatters. 📷: @lasentinelnewspaper","2016","8","27","https://www.instagram.com/p/BJl2m3BjjOP/"
"kamalaharris","4","268","Photo","Today is #WomensEqualityDay, a day when we commemorate the adoption of the 19th Amendment. While gaining the right to vote was a step in the right direction toward women's equality, more still needs to be done. When elected to the Senate, I will be a leading voice for fairness in the workplace. It’s time we eliminate the pay gap once and for all.","2016","8","26","https://www.instagram.com/p/BJlDpSiDcKR/"
"kamalaharris","13","456","Photo","Today is African American Women's Equal Pay Day, which takes place on the day black women catch up to non-hispanic white men’s pay from 2015. It’s inconceivable that the average black woman earns only 63 cents to the average non-hispanic white man’s dollar for the same work. If Congress doesn’t act, this gender pay gap will never close. #BlackWomensEqualPay","2016","8","23","https://www.instagram.com/p/BJdhU8pjee6/"
"kamalaharris","4","408","Photo","We have the same choice in 2016. #ImWithHer","2016","8","21","https://www.instagram.com/p/BJYKe7YjWKo/"
"kamalaharris","1","225","Photo","There are just 80 days left until Election Day. Make sure you are registered to vote and know your polling location, so that your voice will be heard in this election. Register now: http://registertovote.ca.gov/","2016","8","20","https://www.instagram.com/p/BJV6tquDhyh/"
"kamalaharris","2","454","Photo","#TeamKamala surrogate @aldis_hodge stopped by the office this week to thank our volunteers for their hard work! Join us at kamalaharris.org.","2016","8","20","https://www.instagram.com/p/BJT3eqgjmur/"
"kamalaharris","2","402","Photo","Thankful for #TeamKamala!","2016","8","19","https://www.instagram.com/p/BJS_Nxfj_4I/"
"kamalaharris","3","371","Photo","What makes California great? The people and organizations — like the Downtown San Diego Partnership — that are working to help residents, businesses, and visitors thrive.","2016","8","19","https://www.instagram.com/p/BJRoFP9jwPM/"
"kamalaharris","9","341","Photo","Join me on Snapchat and get an inside look at #TeamKamala, plus find out about special filters you can use during campaign events! Visit my bio for the link.","2016","8","19","https://www.instagram.com/p/BJRPjsfjopF/"
"kamalaharris","6","465","Photo","96 years ago today, the 19th Amendment was ratified, women gained the right to vote, and our country took another step toward fulfilling those promises articulated in 1776. Let’s celebrate how far we’ve come and re-commit ourselves to ensuring that everyone who is eligible to cast a vote has the opportunity to do so. Photo: California Historical Society","2016","8","18","https://www.instagram.com/p/BJQwdEWDvGu/"
"kamalaharris","10","530","Photo","Education is the key to our nation’s success. It’s time we start investing in our children and their futures.","2016","8","14","https://www.instagram.com/p/BJGXBEODlbD/"
"kamalaharris","20","606","Photo","When I’m elected to the Senate, I’ll stand up to special interests who are trying to take advantage of working families. Just like I’ve taken on the big banks, oil companies, and predatory for-profit colleges, I will fight to ensure that California families have the opportunity to achieve the American dream.","2016","8","11","https://www.instagram.com/p/BI-ygugjjtA/"
"kamalaharris","11","1094","Photo","Congratulations to the #FinalFive on their historic Olympic gold medals in gymnastics! 📸: AP","2016","8","9","https://www.instagram.com/p/BI6BDPKj5oi/"
"kamalaharris","8","496","Photo","During my interview with Eyewitness Newsmakers, Adrienne Alpert and I talked about the issues important to the people of California. If you’re in the LA area, be sure to watch at 11am on Sunday.","2016","8","7","https://www.instagram.com/p/BIyWbHJjVuT/"
"kamalaharris","8","644","Photo","I had lunch with our interns earlier this week! I’m so inspired by all of these young people who want to pursue a life in public service and create a better future for America.","2016","8","5","https://www.instagram.com/p/BIvjfQNDHVF/"
